<?xml version="1.0" encoding="UTF-8"?>
<Objects xmlns="http://www.gonicus.de/Objects" xmlns:xsi="http://www.w3.org/2001/XMLSchema-instance" xsi:schemaLocation="http://www.gonicus.de/Objects ../object.xsd ">
	<Object>
		<Name>SambaWorkstationContainer</Name>
		<DisplayName>Samba Workstation Container</DisplayName>
		<Description>Organizational unit that can contain Samba workstations</Description>
		<BackendParameters>
			<Backend objectClasses="organizationalUnit" RDN="ou">LDAP</Backend>
		</BackendParameters>
		<Backend>LDAP</Backend>

		<BaseObject>true</BaseObject>
		<FixedRDN>ou=winstations</FixedRDN>
                <StructuralInvisible>true</StructuralInvisible>
		<Container>
			<Type>SambaMachineAccount</Type>
		</Container>
	</Object>
</Objects>

