<?xml version="1.0" encoding="UTF-8"?>
<Objects xmlns="http://www.gonicus.de/Objects" xmlns:xsi="http://www.w3.org/2001/XMLSchema-instance" xsi:schemaLocation="http://www.gonicus.de/Objects ../object.xsd ">
  <Object>
    <Name>OrganizationalUnit</Name>
    <DisplayName>Organizational unit</DisplayName>
    <Description>Organizational unit</Description>
    <BackendParameters>
      <Backend objectClasses="organizationalUnit" RDN="ou">LDAP</Backend>
    </BackendParameters>
    <Backend>LDAP</Backend>
    <Attributes>
      <Attribute>
        <Name>ou</Name>
        <Description></Description>
        <Type>UnicodeString</Type>
        <MultiValue>false</MultiValue>
        <Mandatory>true</Mandatory>
      </Attribute>
      <Attribute>
        <Name>description</Name>
        <Description></Description>
        <Type>UnicodeString</Type>
        <MultiValue>false</MultiValue>
        <Mandatory>false</Mandatory>
      </Attribute>
      <Attribute>
        <Name>businessCategory</Name>
        <Description></Description>
        <Type>UnicodeString</Type>
        <MultiValue>false</MultiValue>
        <Mandatory>false</Mandatory>
      </Attribute>
      <Attribute>
        <Name>st</Name>
        <Description></Description>
        <Type>UnicodeString</Type>
        <MultiValue>false</MultiValue>
        <Mandatory>false</Mandatory>
      </Attribute>
      <Attribute>
        <Name>l</Name>
        <Description></Description>
        <Type>UnicodeString</Type>
        <MultiValue>false</MultiValue>
        <Mandatory>false</Mandatory>
      </Attribute>
      <Attribute>
        <Name>postalAddress</Name>
        <Description></Description>
        <Type>UnicodeString</Type>
        <MultiValue>false</MultiValue>
        <Mandatory>false</Mandatory>
      </Attribute>
      <Attribute>
        <Name>telephoneNumber</Name>
        <Description></Description>
        <Type>UnicodeString</Type>
        <MultiValue>false</MultiValue>
        <Mandatory>false</Mandatory>
      </Attribute>
      <Attribute>
        <Name>facsimileTelephoneNumber</Name>
        <Description></Description>
        <Type>UnicodeString</Type>
        <MultiValue>false</MultiValue>
        <Mandatory>false</Mandatory>
      </Attribute>
      <Attribute>
        <Name>manager</Name>
        <Description></Description>
        <Type>UnicodeString</Type>
        <MultiValue>false</MultiValue>
        <Mandatory>false</Mandatory>
        <Validators>
          <Condition>
            <Name>ObjectWithPropertyExists</Name>
            <Param>User</Param>
            <Param>dn</Param>
          </Condition>
        </Validators>
      </Attribute>
    </Attributes>
    <Container>
      <Type>PeopleContainer</Type>
      <Type>GroupContainer</Type>
      <Type>OrganizationalUnit</Type>
      <Type>Organization</Type>
      <Type>Locality</Type>
      <Type>DomainComponent</Type>
      <Type>Domain</Type>
      <Type>Country</Type>
      <Type>SambaDomain</Type>
      <Type>AclRole</Type>
    </Container>
    <BaseObject>true</BaseObject>
    <Find>
      <Aspect>
        <Tag>OrganizationalUnit</Tag>
        <Keyword>Unit</Keyword>
        <Keyword>Organization</Keyword>
        <Search>ou</Search>
        <Resolve filter="DN">manager</Resolve>
        <Result>
          <Map>
            <Source>ou</Source>
            <Destination>title</Destination>
          </Map>
        </Result>
      </Aspect>
    </Find>
  </Object>
</Objects>

