<?xml version="1.0" encoding="UTF-8"?>
<Objects xmlns="http://www.gonicus.de/Objects" xmlns:xsi="http://www.w3.org/2001/XMLSchema-instance" xsi:schemaLocation="http://www.gonicus.de/Objects ../object.xsd ">
	<Object>
		<Name>PeopleContainer</Name>
		<DisplayName>Users</DisplayName>
		<Description>Organizational unit that can contain users</Description>
		<BackendParameters>
			<Backend objectClasses="organizationalUnit" RDN="ou">LDAP</Backend>
		</BackendParameters>
		<Backend>LDAP</Backend>
		<Container>
			<Type>User</Type>
		</Container>
		<BaseObject>true</BaseObject>
		<FixedRDN>ou=people</FixedRDN>
    <Find>
      <Aspect>
        <Tag>PeopleContainer</Tag>
        <Keyword>User</Keyword>
        <Search>ou</Search>
        <Resolve filter="DN">manager</Resolve>
        <Result>
          <Map>
            <Source>ou</Source>
            <Destination>title</Destination>
          </Map>
        </Result>
      </Aspect>
    </Find>
	</Object>
</Objects>

